{
    "$schema": "http://json-schema.org/draft-07/schema#",
    "$id": "https://raw.githubusercontent.com/EricPonthiaux/Kodamiko/main/tools/schemas/recipe.schema.json",
    "title": "Kodamiko recipe",
    "description": "A recipe's recipe.json: how to make one kind of project on one system. Its folder also holds files/ (the new project's files), instructions.md (added to the agent's system prompt) and skills/ (the agent's skills there), all optional.",
    "type": "object",
    "required": [
        "title"
    ],
    "properties": {
        "$schema": {
            "type": "string"
        },
        "title": {
            "description": "Its name in the list of recipes, e.g. \"Qt Widgets · CMake · MSVC\".",
            "type": "string",
            "minLength": 1
        },
        "description": {
            "description": "Shown under the list when it is chosen: what the new project holds and what it needs.",
            "type": "string"
        },
        "systems": {
            "description": "The systems it is made for; every system when it is not given.",
            "$ref": "#/definitions/systems"
        },
        "language": {
            "description": "The language family it is attached to in a project; none for a recipe of no language.",
            "enum": [
                "cpp",
                "java",
                "javascript",
                "python"
            ]
        },
        "environment": {
            "description": "What it adds to the environment of the project's terminals, run configurations and agent sessions.",
            "type": "object",
            "properties": {
                "visualStudio": {
                    "description": "Windows: the MSVC developer environment, as an x64 Native Tools prompt has it (cl, link, the SDK, Visual Studio's CMake and Ninja).",
                    "type": "boolean"
                },
                "path": {
                    "description": "Folders put first in the PATH.",
                    "$ref": "#/definitions/strings"
                },
                "variables": {
                    "description": "Variables that replace the editor's.",
                    "$ref": "run.schema.json#/definitions/variables"
                }
            },
            "additionalProperties": false
        },
        "requires": {
            "description": "The tools its projects need: Kodamiko downloads those missing to ~/.kodamiko/tools, and puts them in the project's environment as each one says.",
            "type": "array",
            "items": {
                "$ref": "#/definitions/requirement"
            }
        },
        "run": {
            "description": "Written to the new project's .kodamiko/run.json; added to an existing project's own configurations. {{identifier}} in a command or a folder stands for the project's identifier.",
            "type": "array",
            "items": {
                "$ref": "run.schema.json#/definitions/configuration"
            }
        },
        "setup": {
            "description": "Commands run once, one after the other, when the new project is first opened (npm install, a CMake configure): what Build needs before it works. {{identifier}} stands for the project's identifier.",
            "$ref": "#/definitions/strings"
        },
        "prompts": {
            "description": "Prompts typed in the agent's prompt from the Project menu, for the user to complete.",
            "type": "array",
            "items": {
                "type": "object",
                "required": [
                    "title",
                    "text"
                ],
                "properties": {
                    "title": {
                        "description": "Its name in the Project menu.",
                        "type": "string",
                        "minLength": 1
                    },
                    "text": {
                        "description": "The text typed in the agent's prompt.",
                        "type": "string",
                        "minLength": 1
                    }
                },
                "additionalProperties": false
            }
        },
        "parameters": {
            "description": "Choices the new project is made with, offered when it is created and kept in the project. {{name}} stands for the value chosen, and the value's variables for theirs, in the recipe's files, requirements, commands, prompts, instructions and servers.",
            "type": "array",
            "items": {
                "type": "object",
                "required": [
                    "name",
                    "values"
                ],
                "properties": {
                    "name": {
                        "description": "Its placeholder's name, e.g. \"angular\" for {{angular}}.",
                        "type": "string",
                        "pattern": "^[A-Za-z][A-Za-z0-9_]*$"
                    },
                    "title": {
                        "description": "Its label in the New Project form; the name when it is not given.",
                        "type": "string"
                    },
                    "values": {
                        "description": "The values offered, the first one by default: a value, or a value with the placeholders it sets.",
                        "type": "array",
                        "minItems": 1,
                        "items": {
                            "anyOf": [
                                {
                                    "type": "string",
                                    "minLength": 1
                                },
                                {
                                    "type": "object",
                                    "required": [
                                        "value"
                                    ],
                                    "properties": {
                                        "value": {
                                            "type": "string",
                                            "minLength": 1
                                        },
                                        "variables": {
                                            "description": "Placeholders set with the value, e.g. {\"typescript\": \"~6.0.0\"} for {{typescript}}.",
                                            "type": "object",
                                            "additionalProperties": {
                                                "type": "string"
                                            }
                                        }
                                    },
                                    "additionalProperties": false
                                }
                            ]
                        }
                    }
                },
                "additionalProperties": false
            }
        },
        "languageServers": {
            "description": "Language servers for languages Kodamiko has none for (Angular's templates): a Node script of a tool the recipe requires.",
            "type": "array",
            "items": {
                "type": "object",
                "required": [
                    "name",
                    "tool",
                    "script",
                    "languages"
                ],
                "properties": {
                    "name": {
                        "description": "Its name in the preferences and the messages.",
                        "type": "string",
                        "minLength": 1
                    },
                    "tool": {
                        "description": "The requirement that installs it.",
                        "type": "string",
                        "minLength": 1
                    },
                    "script": {
                        "description": "The script run with Node, in the tool's folder.",
                        "type": "string",
                        "minLength": 1
                    },
                    "arguments": {
                        "description": "Its arguments; {{home}} stands for the tool's folder, {{project}} for the project's.",
                        "$ref": "#/definitions/strings"
                    },
                    "languages": {
                        "description": "The languages it serves, e.g. \"html\".",
                        "$ref": "#/definitions/strings"
                    },
                    "triggerCharacters": {
                        "description": "The characters after which it completes.",
                        "type": "string"
                    }
                },
                "additionalProperties": false
            }
        },
        "servers": {
            "description": "The servers Kodamiko knows, by name (\"jdtls\"), as the recipe's projects run them: their version and the runtime they run on.",
            "type": "object",
            "additionalProperties": {
                "$ref": "#/definitions/server"
            }
        },
        "serverOptions": {
            "description": "What the recipe adds to the options of a server Kodamiko knows, by its name (\"typescript-language-server\"): objects merged key by key, anything else replaced. {{project}} in their texts stands for the project's folder.",
            "type": "object",
            "additionalProperties": {
                "type": "object",
                "properties": {
                    "initialization": {
                        "description": "Its initializationOptions.",
                        "type": "object"
                    },
                    "settings": {
                        "description": "Its workspace settings.",
                        "type": "object"
                    }
                },
                "additionalProperties": false
            }
        }
    },
    "additionalProperties": false,
    "definitions": {
        "server": {
            "description": "How the recipe's projects run a server Kodamiko knows: in place of the version the project chose and of the runtime Kodamiko's catalog gives it.",
            "type": "object",
            "properties": {
                "version": {
                    "description": "The server's version Kodamiko downloads, e.g. \"1.62.0\".",
                    "type": "string",
                    "minLength": 1
                },
                "runtime": {
                    "description": "What the server itself runs on, whatever the project's runtime, e.g. {\"tool\": \"jdk\", \"version\": \"25\"} for jdtls 1.62.0.",
                    "type": "object",
                    "required": [
                        "tool",
                        "version"
                    ],
                    "properties": {
                        "tool": {
                            "description": "A runtime Kodamiko knows how to install: \"jdk\", \"node\".",
                            "type": "string",
                            "minLength": 1
                        },
                        "version": {
                            "description": "Its major version.",
                            "type": "string",
                            "minLength": 1
                        }
                    },
                    "additionalProperties": false
                }
            },
            "additionalProperties": false
        },
        "strings": {
            "type": "array",
            "items": {
                "type": "string",
                "minLength": 1
            }
        },
        "systems": {
            "type": "array",
            "items": {
                "enum": [
                    "windows",
                    "linux",
                    "macos"
                ]
            },
            "uniqueItems": true
        },
        "requirement": {
            "description": "A tool the recipe requires, and where its files go in the project's environment. {{home}} in \"path\" and \"variables\" stands for the tool's folder.",
            "type": "object",
            "required": [
                "tool"
            ],
            "properties": {
                "tool": {
                    "description": "The tool's id: one Kodamiko knows how to install (\"jdk\", \"node\", \"qt\"), or any other with a \"download\" or a \"program\" to look for.",
                    "type": "string",
                    "minLength": 1
                },
                "version": {
                    "description": "The version it needs; {{version}} in the download's addresses.",
                    "type": "string"
                },
                "kit": {
                    "description": "Qt: the kit, e.g. \"gcc_64\", \"macos\", \"win64_msvc2022_64\".",
                    "type": "string"
                },
                "modules": {
                    "description": "Qt: the add-on modules, e.g. \"qtcharts\".",
                    "$ref": "#/definitions/strings"
                },
                "program": {
                    "description": "The program found in the PATH when the tool is already installed, e.g. \"mvn\".",
                    "type": "string"
                },
                "systems": {
                    "description": "The systems it is required on; every system when it is not given.",
                    "$ref": "#/definitions/systems"
                },
                "download": {
                    "description": "Where to download it, by system and processor: \"windows-x64\", \"linux-aarch64\"..., else \"windows\", \"linux\", \"macos\", else \"any\".",
                    "type": "object",
                    "patternProperties": {
                        "^(any|(windows|linux|macos)(-(x64|aarch64))?)$": {
                            "$ref": "#/definitions/download"
                        }
                    },
                    "additionalProperties": false
                },
                "path": {
                    "description": "Folders put first in the PATH. One that does not exist is left out, so a recipe lists the layouts of every system.",
                    "$ref": "#/definitions/strings"
                },
                "variables": {
                    "description": "Variables of the project's environment, e.g. {\"JAVA_HOME\": \"{{home}}\"}.",
                    "$ref": "run.schema.json#/definitions/variables"
                }
            },
            "additionalProperties": false
        },
        "download": {
            "description": "An archive of the tool and how to check it, or npm packages. An archive without a checksum or a known format is not installed.",
            "type": "object",
            "anyOf": [
                {
                    "required": [
                        "url",
                        "checksum"
                    ]
                },
                {
                    "required": [
                        "url",
                        "checksumUrl"
                    ]
                },
                {
                    "required": [
                        "npm"
                    ]
                }
            ],
            "properties": {
                "npm": {
                    "description": "Packages installed with npm in the tool's folder instead of an archive; {{version}} stands for the requirement's version.",
                    "$ref": "#/definitions/strings"
                },
                "url": {
                    "description": "The archive's address; {{version}} stands for the requirement's version.",
                    "type": "string",
                    "minLength": 1
                },
                "checksum": {
                    "description": "The archive's hash, in hexadecimal.",
                    "type": "string",
                    "pattern": "^[0-9A-Fa-f]+$"
                },
                "checksumUrl": {
                    "description": "The address of a file holding the archive's hash; {{url}} stands for the archive's address, {{version}} for the requirement's version.",
                    "type": "string",
                    "minLength": 1
                },
                "algorithm": {
                    "description": "The hash's algorithm; \"sha256\" when it is not given.",
                    "enum": [
                        "sha256",
                        "sha512"
                    ]
                },
                "format": {
                    "description": "The archive's format; read from the URL when it is not given.",
                    "enum": [
                        "zip",
                        "tar.gz",
                        "tgz",
                        "7z"
                    ]
                },
                "check": {
                    "description": "A file of the archive that must be there once it is extracted, e.g. \"bin/mvn\".",
                    "type": "string"
                }
            },
            "additionalProperties": false
        }
    }
}
