{
    "$schema": "https://raw.githubusercontent.com/EricPonthiaux/Duet/main/tools/schemas/recipe.schema.json",
    "title": "Qt Widgets · CMake",
    "language": "cpp",
    "description": "A Qt 6 Widgets window, built with the system's compiler and Qt 6.10, downloaded if the machine has none.",
    "systems": [
        "linux",
        "macos"
    ],
    "requires": [
        {
            "tool": "cmake",
            "version": "4.4.4",
            "program": "cmake",
            "download": {
                "linux-x64": {
                    "url": "https://github.com/Kitware/CMake/releases/download/v{{version}}/cmake-{{version}}-linux-x86_64.tar.gz",
                    "checksumUrl": "https://github.com/Kitware/CMake/releases/download/v{{version}}/cmake-{{version}}-SHA-256.txt",
                    "check": "bin/cmake"
                },
                "linux-aarch64": {
                    "url": "https://github.com/Kitware/CMake/releases/download/v{{version}}/cmake-{{version}}-linux-aarch64.tar.gz",
                    "checksumUrl": "https://github.com/Kitware/CMake/releases/download/v{{version}}/cmake-{{version}}-SHA-256.txt",
                    "check": "bin/cmake"
                },
                "macos": {
                    "url": "https://github.com/Kitware/CMake/releases/download/v{{version}}/cmake-{{version}}-macos-universal.tar.gz",
                    "checksumUrl": "https://github.com/Kitware/CMake/releases/download/v{{version}}/cmake-{{version}}-SHA-256.txt",
                    "check": "CMake.app/Contents/bin/cmake"
                }
            },
            "path": [
                "{{home}}/bin",
                "{{home}}/CMake.app/Contents/bin"
            ]
        },
        {
            "tool": "clang-format",
            "version": "23.1.3",
            "program": "clang-format",
            "download": {
                "linux-x64": {
                    "url": "https://files.pythonhosted.org/packages/11/d1/658d3da4dcbca98620956868c7cf6f4ba19fccecbdfc30cc055e19c9d4a7/clang_format-23.1.3-py2.py3-none-manylinux_2_27_x86_64.manylinux_2_28_x86_64.whl",
                    "checksum": "58bf1804216501669832a39f2415e14284337438a062ff564729792adec664ac",
                    "format": "zip",
                    "check": "clang_format/data/bin/clang-format"
                },
                "linux-aarch64": {
                    "url": "https://files.pythonhosted.org/packages/1d/00/a0f99e24dc4892fb120e82fa9cf6e8fcb92714181ffd1165ab7eaf5ba1fd/clang_format-23.1.3-py2.py3-none-manylinux_2_26_aarch64.manylinux_2_28_aarch64.whl",
                    "checksum": "072113527b49a9c0ab9058006d9fe20e583823e6482608a34e1883dd2c49ae7d",
                    "format": "zip",
                    "check": "clang_format/data/bin/clang-format"
                },
                "macos-x64": {
                    "url": "https://files.pythonhosted.org/packages/05/0f/a1813ede1e149e700ee810baf22dd9c863ca0bd719d73f86e8c10b67a6bb/clang_format-23.1.3-py2.py3-none-macosx_10_9_x86_64.whl",
                    "checksum": "0b8e86cc5a870ca42989bd1ccfe5220fbab96e386922d0a8f0ca350db30593df",
                    "format": "zip",
                    "check": "clang_format/data/bin/clang-format"
                },
                "macos-aarch64": {
                    "url": "https://files.pythonhosted.org/packages/47/a5/2007b7a7a53dfe417e66d0a6b38b2f87f16391bfe6fe522d436d1e50be1c/clang_format-23.1.3-py2.py3-none-macosx_11_0_arm64.whl",
                    "checksum": "79f53ac55434af6dda88eb90eeb65d903ff920c910f78041de41e3ca666dfba5",
                    "format": "zip",
                    "check": "clang_format/data/bin/clang-format"
                }
            },
            "path": [
                "{{home}}/clang_format/data/bin"
            ]
        },
        {
            "tool": "qt",
            "version": "6.10",
            "kit": "gcc_64",
            "systems": [
                "linux"
            ],
            "path": [
                "{{home}}/bin"
            ],
            "variables": {
                "CMAKE_PREFIX_PATH": "{{home}}"
            }
        },
        {
            "tool": "qt",
            "version": "6.10",
            "kit": "macos",
            "systems": [
                "macos"
            ],
            "path": [
                "{{home}}/bin"
            ],
            "variables": {
                "CMAKE_PREFIX_PATH": "{{home}}"
            }
        }
    ],
    "run": [
        {
            "name": "Build",
            "kind": "build",
            "command": "cmake --build build"
        },
        {
            "name": "Run",
            "kind": "run",
            "command": "build/{{identifier}}"
        },
        {
            "name": "Debug",
            "kind": "debug",
            "command": "gdb build/{{identifier}}"
        }
    ],
    "setup": [
        "cmake -S . -B build -DCMAKE_BUILD_TYPE=Debug"
    ],
    "prompts": [
        {
            "title": "Add a Dialog",
            "text": "Add a dialog to this Qt application: "
        },
        {
            "title": "Add a Menu Action",
            "text": "Add a menu action to the main window that "
        },
        {
            "title": "Add a Settings Page with QSettings",
            "text": "Add a settings dialog, saved with QSettings, with these settings: "
        }
    ]
}
